Phase,Task Number,Title,Description,Labels,Size,Priority,Component,Estimated Hours,Dependencies
"Phase 8: Deployment & Production","#95","Production Health Monitoring","Uptime monitoring. Error rate tracking. Response time monitoring. Database connection pool. Alert setup (email/Slack)","devops,monitoring",M,P1,DevOps,10,#94
"Phase 8: Deployment & Production","#96","Backup & Recovery Setup","PostgreSQL daily backups. MinIO backup strategy. Qdrant snapshots. Recovery testing. Document restore process","devops,backup",M,P1,DevOps,12,#94
"Phase 8: Deployment & Production","#97","Security Hardening","Enable HTTPS only. Configure security headers. Rate limiting on API endpoints. Input sanitization review. Security audit checklist. Document security measures","devops,security",L,P0,DevOps,16,#94
"Phase 8: Deployment & Production","#98","Production Smoke Tests","Create account. Create application. Upload document. Wait for processing. Query document. Verify response. Test with multiple users","testing,deployment",M,P0,Testing,12,#94
"Phase 9: Documentation & Polish","#99","User Guide - Getting Started","How to create account. Creating first application. Uploading documents. Querying your knowledge base. Screenshots and examples","docs",M,P1,Documentation,10,Multiple
"Phase 9: Documentation & Polish","#100","Developer Setup Guide","Prerequisites installation. Clone repository. Docker Compose setup. Environment variables. First run guide. Troubleshooting common issues","docs",M,P0,Documentation,10,#2
"Phase 9: Documentation & Polish","#101","API Documentation","Complete API reference. Authentication guide. Request/response examples. Error codes reference. Rate limits. Python and JavaScript examples","docs,backend",L,P1,Documentation,16,#78
"Phase 9: Documentation & Polish","#102","Architecture Documentation","System architecture diagram. Multi-tenancy explanation. Data flow diagrams. Technology decisions log. Scaling considerations","docs,architecture",M,P1,Documentation,12,Multiple
"Phase 9: Documentation & Polish","#103","Deployment Guide","Production deployment steps. Environment configuration. Monitoring setup. Backup/restore procedures. Scaling guide","docs,devops",M,P1,Documentation,10,#94
"Phase 9: Documentation & Polish","#104","Contributing Guide","Code style guidelines. Branch naming conventions. PR process. Testing requirements. Code review checklist","docs",S,P1,Documentation,5,None
"Phase 9: Documentation & Polish","#105","Learning Logs Compilation","Each team member writes ""What I Learned"". Challenges faced and solutions. Would-do-differently section. Tips for future contributors. Compile into blog posts","docs,learning",M,P2,Documentation,12,Multiple
"Phase 9: Documentation & Polish","#106","README.md Polish","Project overview. Key features. Quick start. Architecture summary. Screenshots. Links to detailed docs. Badges (build status, etc.)","docs",M,P1,Documentation,8,Multiple
"Phase 9: Documentation & Polish","#107","Demo Video Creation","Screen recording of full workflow. Voiceover explanation. Show multi-tenancy. Show RAG in action. Upload to YouTube. Embed in README","docs,demo",L,P2,Documentation,16,Multiple
"Phase 9: Documentation & Polish","#108","Performance Benchmarks Document","Document upload speeds. Query response times. Concurrent user capacity. Resource usage metrics. Cost estimates","docs,performance",M,P2,Documentation,10,"#85,#86"
"Phase 10: Polish & Launch","#109","UI/UX Polish","Consistent spacing and alignment. Loading states everywhere. Error messages user-friendly. Empty states with guidance. Mobile responsiveness check. Dark mode support (optional)","frontend,ui,polish",L,P1,Frontend,20,Multiple
"Phase 10: Polish & Launch","#110","Input Validation Review","Review all forms. Consistent error messages. Client + server validation. SQL injection prevention. XSS prevention. Document validation rules","frontend,backend,security",M,P0,Security,12,Multiple
"Phase 10: Polish & Launch","#111","Performance Optimization","Next.js bundle analysis. Lazy loading components. Image optimization. API response caching. Database query optimization. Document improvements","performance,optimization",L,P1,Multiple,20,Multiple
"Phase 10: Polish & Launch","#112","Accessibility Audit","Keyboard navigation. Screen reader testing. Color contrast checking. ARIA labels. Focus management. Document findings","frontend,accessibility",M,P2,Frontend,12,Multiple
"Phase 10: Polish & Launch","#113","Error Recovery Flows","Handle failed uploads gracefully. Retry failed processing. Recover from Ollama downtime. Database connection failures. Clear user guidance","frontend,backend,reliability",M,P1,Multiple,12,Multiple
"Phase 10: Polish & Launch","#114","Beta Testing","Invite 5-10 external users. Collect feedback. Monitor for errors. Track usage patterns. Document issues","testing,beta",L,P0,Testing,20,#94
"Phase 10: Polish & Launch","#115","Fix Critical Beta Issues","Prioritize feedback. Fix blocking bugs. Improve unclear UX. Performance issues. Security concerns","bug-fix,critical",Varies,P0,Multiple,Varies,#114
"Phase 10: Polish & Launch","#116","Launch Announcement","Write launch post (dev.to, Medium). Share on Twitter/LinkedIn. Post in relevant communities. Create Product Hunt page. Prepare demo for inquiries","marketing,launch",M,P1,Marketing,10,#94
"Phase 10: Polish & Launch","#117","🎉 Launch Celebration","Deploy to production. Monitor for 24 hours. Team retrospective meeting. Celebrate achievements. Plan next features. Share learnings","milestone,celebration",Party,P0,All,N/A,All
"Future Enhancements","#118","Streaming Query Responses","Implement SSE in FastAPI. Stream Ollama responses. Update UI progressively. Better user experience for long queries","enhancement,ai",L,P2,Backend,20,#72
"Future Enhancements","#119","Conversation History","Store query context. Multi-turn conversations. Context management. Clear conversation button","enhancement,feature",L,P2,Frontend,16,#74
"Future Enhancements","#120","Advanced Document Types","Support for images (OCR + vision models). Excel/CSV processing. PowerPoint presentations. Markdown with embedded images","enhancement,document-processing",XL,P2,Ingest,40,#55
"Future Enhancements","#121","Fine-tune Custom Models","Collect domain-specific data. Fine-tune Llama2 on user data. Deploy custom models per application. A/B testing different models","enhancement,ai,advanced",XL,P3,AI/ML,80,#19
"Future Enhancements","#122","SQL Report Generation","Connect to user databases. Natural language to SQL. Generate reports from queries. Export to PDF/Excel","enhancement,feature",XL,P3,Backend,60,#72
"Future Enhancements","#123","API Rate Limiting","Token-based rate limits. Per-application quotas. Usage tracking. Billing preparation","enhancement,backend",M,P2,Backend,12,#66
"Future Enhancements","#124","Analytics Dashboard","Query analytics per application. Most asked questions. Response quality metrics. Usage trends. Export reports","enhancement,analytics",L,P2,Frontend,20,#74
"Future Enhancements","#125","Webhooks","Notify on document processing complete. Notify on errors. Custom integrations. Webhook testing UI","enhancement,integration",M,P2,Backend,12,#61
