Phase,Task Number,Title,Description,Labels,Size,Priority,Component,Estimated Hours,Dependencies
"Phase 1: Foundation & Setup","#1","Setup Monorepo Structure","Create root package.json with npm workspaces. Initialize apps/web (Next.js), apps/api (Python with uv), services/ingest (Python with uv). Create packages/shared for types. Setup .gitignore and .env.example files","infrastructure,setup",M,P0,Infrastructure,12,None
"Phase 1: Foundation & Setup","#2","Docker Compose - Core Services","PostgreSQL 16 container with persistent volume. Redis 7 container with persistence config. MinIO container with bucket setup. Qdrant container with persistent storage. Create docker-compose.yml and docker-compose.dev.yml. Document connection strings and ports","infrastructure,docker",L,P0,Infrastructure,20,#1
"Phase 1: Foundation & Setup","#3","Install and Configure Ollama","Install Ollama on development machines. Pull llama2:7b model. Pull mistral:7b model. Test basic inference with both models. Document model selection rationale. Create troubleshooting guide","ai,setup",M,P1,AI/ML,10,None
"Phase 1: Foundation & Setup","#4","PostgreSQL Schema Design","Design ERD for all entities. Define relationships (User, Application, Document, Token). Plan indexes for multi-tenancy. Document isolation strategy. Review with team","database,architecture",M,P0,Database,12,#2
"Phase 1: Foundation & Setup","#5","Setup CI/CD - Frontend","GitHub Actions workflow for apps/web. Lint check (ESLint). Type check (TypeScript). Build verification. Run on PR and main branch","devops,frontend",S,P1,DevOps,4,#1
"Phase 1: Foundation & Setup","#6","Setup CI/CD - Backend Services","GitHub Actions for apps/api. Python lint (ruff). Type check (mypy). Test execution (pytest). Similar workflow for services/ingest","devops,backend",S,P1,DevOps,5,#1
"Phase 1: Foundation & Setup","#7","Initialize Next.js 15 Project","Setup Next.js 15 with App Router. Configure TypeScript strict mode. Setup next.config.js. Configure path aliases (@/, @components, etc.). Create basic folder structure (app, components, lib)","frontend,setup",S,P0,Frontend,4,#1
"Phase 1: Foundation & Setup","#8","Setup Mantine 8","Install all Mantine packages. Configure MantineProvider. Setup PostCSS config. Create theme.ts with custom colors. Test basic components (Button, Text, Card). Setup Tabler Icons","frontend,ui",M,P0,Frontend,8,#7
"Phase 1: Foundation & Setup","#9","Configure TypeORM in Next.js","Install TypeORM and dependencies. Create DataSource configuration. Setup connection in API routes. Create utils/db.ts for connection management. Test database connection. Setup for multi-tenancy","frontend,database",M,P0,Frontend,10,#2,#7
"Phase 1: Foundation & Setup","#10","Create TypeORM Entities - User","User entity with decorators. Fields: id, email, password, role, createdAt. Add validation decorators. Create UserRepository. Write migration. Test CRUD operations","database,backend",S,P0,Database,4,#9
"Phase 1: Foundation & Setup","#11","Create TypeORM Entities - Application","Application entity with decorators. Fields: id, name, description, systemPrompt. ManyToMany relation with User. OneToMany relations (Documents, Tokens). Write migration. Test relationships","database,backend",M,P0,Database,8,#10
"Phase 1: Foundation & Setup","#12","Create TypeORM Entities - Document","Document entity with decorators. Fields: id, filename, status, applicationId, metadata. ManyToOne relation to Application. Status enum (PENDING, PROCESSING, INDEXED, FAILED). Write migration","database,backend",S,P0,Database,4,#11
"Phase 1: Foundation & Setup","#13","Create TypeORM Entities - Token","Token entity with decorators. Fields: id, tokenHash, applicationId, lastUsedAt. ManyToOne relation to Application. Expiration logic. Write migration","database,backend",S,P0,Database,4,#11
"Phase 1: Foundation & Setup","#14","Setup Iron Session","Install iron-session. Create session configuration. Define session data types. Create getSession() utility. Create withAuth() middleware. Test session encryption","frontend,auth",M,P0,Frontend,8,#7
"Phase 1: Foundation & Setup","#15","Implement Password Hashing","Install bcrypt. Create hashPassword() utility. Create comparePassword() utility. Set salt rounds to 12. Write unit tests","backend,auth,security",XS,P0,Backend,2,None
"Phase 1: Foundation & Setup","#16","Initialize FastAPI Project","Setup FastAPI with uv. Create pyproject.toml. Configure project structure (routers, models, utils). Setup main.py with app factory. Configure CORS. Test basic endpoint","backend,setup",S,P0,Backend,5,#1
"Phase 1: Foundation & Setup","#17","FastAPI Environment Configuration","Install pydantic-settings. Create settings.py with env validation. Database connection strings. Redis connection. Qdrant connection. Ollama endpoint. Test configuration loading","backend,config",S,P0,Backend,3,#16
"Phase 1: Foundation & Setup","#18","Setup Qdrant Client","Install qdrant-client. Create qdrant.py client wrapper. Connection configuration. Health check function. Collection creation utility. Test connection","backend,vector-db",S,P1,Backend,4,#2,#16
"Phase 1: Foundation & Setup","#19","Setup Ollama Integration","Install ollama Python client. Create ollama.py wrapper. Test connection to local Ollama. Test inference with llama2. Test inference with mistral. Document response formats","backend,ai",M,P1,Backend,8,#3,#16
"Phase 2: Authentication & User Management","#20","Build Registration API Route","POST /api/auth/register. Validate email and password with Zod. Check for duplicate email. Hash password with bcrypt. Create user in database. Create session. Return success response","frontend,auth",M,P0,Frontend,10,"#10,#14,#15"
"Phase 2: Authentication & User Management","#21","Build Login API Route","POST /api/auth/login. Validate credentials. Compare password hash. Create Iron Session. Set session cookie. Return user data (without password)","frontend,auth",M,P0,Frontend,8,"#14,#15"
"Phase 2: Authentication & User Management","#22","Build Logout API Route","POST /api/auth/logout. Destroy Iron Session. Clear cookie. Return success","frontend,auth",XS,P0,Frontend,1,#14
"Phase 2: Authentication & User Management","#23","Create Auth Middleware","Check session exists. Validate session data. Attach user to request context. Handle expired sessions. Redirect unauthorized requests","frontend,auth,middleware",M,P0,Frontend,8,#14
"Phase 2: Authentication & User Management","#24","Build Login Page UI","Create /login route. Mantine form with email/password. Form validation with Zod. Error message display. Loading state. Redirect to dashboard on success","frontend,ui",M,P0,Frontend,10,"#8,#21"
"Phase 2: Authentication & User Management","#25","Build Registration Page UI","Create /register route. Multi-field form (name, email, password, confirm). Password strength indicator. Form validation. Success message. Redirect to login","frontend,ui",M,P0,Frontend,10,"#8,#20"
"Phase 2: Authentication & User Management","#26","Create Dashboard Layout","Protected route wrapper. Sidebar navigation with Mantine. Header with user menu. Application switcher component. Responsive design. Logout button","frontend,ui",L,P0,Frontend,16,"#8,#23"
"Phase 2: Authentication & User Management","#27","Build User Management Page (Admin)","List all users in Mantine Table. Search and filter functionality. Pagination. Role badges (Admin, User). Edit and delete actions","frontend,ui,admin",L,P1,Frontend,16,"#8,#26"
"Phase 2: Authentication & User Management","#28","Create User API - Admin only","POST /api/users (create user). GET /api/users (list users). PUT /api/users/:id (update user). DELETE /api/users/:id (soft delete). Admin role verification","frontend,api,admin",M,P1,Frontend,12,"#10,#23"
"Phase 3: Multi-Tenant Application Management","#29","Build Applications List Page","GET /api/applications (user's apps only). Card view with Mantine Grid. Show app name, description, doc count. Create new application button. Filter by user access","frontend,ui,multi-tenant",M,P0,Frontend,10,"#8,#11,#26"
"Phase 3: Multi-Tenant Application Management","#30","Create Application Form","Modal with Mantine Form. Fields: name, description, system prompt. Zod validation. Rich text editor for system prompt. User assignment multiselect","frontend,ui",M,P0,Frontend,12,"#8,#29"
"Phase 3: Multi-Tenant Application Management","#31","API - Create Application","POST /api/applications. Validate input. Create Application entity. Assign creator as maintainer. Create Qdrant collection (app_{id}_docs). Create MinIO folder (app-{id}/). Return created application","frontend,api,multi-tenant",L,P0,Frontend,16,"#11,#18,#30"
"Phase 3: Multi-Tenant Application Management","#32","API - Get User's Applications","GET /api/applications. Query with TypeORM relations. Filter by user access (many-to-many). Include document counts. Include token counts. Return application list","frontend,api,multi-tenant",M,P0,Frontend,8,"#11,#23"
"Phase 3: Multi-Tenant Application Management","#33","API - Update Application","PUT /api/applications/:id. Verify user has access. Update name, description, system prompt. Update user assignments. Return updated application","frontend,api",M,P1,Frontend,10,"#11,#23"
"Phase 3: Multi-Tenant Application Management","#34","Build Application Detail Page","Show application overview. Document list. Token list. System prompt display/edit. Usage statistics placeholder. Settings section","frontend,ui",L,P1,Frontend,16,"#8,#32"
"Phase 3: Multi-Tenant Application Management","#35","Application Switcher Component","Dropdown in header (Mantine Select). List user's applications. Switch active application. Store in localStorage + context. Update UI when switched","frontend,ui,multi-tenant",M,P0,Frontend,10,"#8,#26,#32"
"Phase 3: Multi-Tenant Application Management","#36","Multi-Tenancy Verification Test","Test user A cannot access user B's apps. Test application ID filtering in queries. Test Qdrant collection isolation. Test MinIO path isolation. Document test results","testing,multi-tenant,security",M,P0,Testing,12,"#31,#32"
"Phase 4: Document Upload & Storage","#37","Setup MinIO Client","Install @aws-sdk/client-s3. Create minioClient.ts wrapper. Upload utility function. Download utility function. Pre-signed URL generation. Test upload/download","frontend,storage",M,P0,Frontend,10,#2
"Phase 4: Document Upload & Storage","#38","File Validation Utilities","MIME type checking. File size limit (20MB). Extension whitelist (.pdf, .docx, .txt, .md). Create validation schemas with Zod. Error messages","frontend,validation",S,P0,Frontend,4,None
"Phase 4: Document Upload & Storage","#39","Build Document Upload Page","Mantine Dropzone component. Drag & drop support. File preview list. Upload progress indicator. Multi-file upload support. Error handling UI","frontend,ui",L,P0,Frontend,16,"#8,#35,#37,#38"
"Phase 4: Document Upload & Storage","#40","API - Upload Document","POST /api/documents. Verify user has app access. Validate file type and size. Generate unique filename. Upload to MinIO (app-{id}/documents/). Create Document entity with applicationId. Enqueue processing job. Return document metadata","frontend,api,multi-tenant",L,P0,Frontend,18,"#12,#23,#37,#38"
"Phase 4: Document Upload & Storage","#41","Build Documents List Page","Mantine Table with documents. Filter by current application only. Status badges (PENDING, PROCESSING, INDEXED, FAILED). Search by filename. Sort by upload date. Delete button. Download button","frontend,ui",L,P0,Frontend,16,"#8,#35"
"Phase 4: Document Upload & Storage","#42","API - Get Application Documents","GET /api/documents?applicationId={id}. Verify user access to application. Query with TypeORM where clause. Filter by applicationId (multi-tenant!). Return documents with metadata","frontend,api,multi-tenant",M,P0,Frontend,8,"#12,#23"
"Phase 4: Document Upload & Storage","#43","API - Delete Document","DELETE /api/documents/:id. Verify user access to document's application. Delete from MinIO. Delete from database. Enqueue vector cleanup job. Return success","frontend,api",M,P1,Frontend,10,"#12,#23,#37"
"Phase 4: Document Upload & Storage","#44","Setup Redis Job Queue (Frontend)","Install ioredis and bullmq. Create queue instance. Job schema definitions. Connection configuration. Test enqueue","frontend,queue",M,P0,Frontend,10,#2
"Phase 4: Document Upload & Storage","#45","Document Processing Job Producer","Create job on document upload. Job payload: { documentId, applicationId, filename }. Priority configuration. Retry settings (3 attempts). Store job ID in Document entity","frontend,queue",M,P0,Frontend,10,"#12,#40,#44"
"Phase 4: Document Upload & Storage","#46","Job Status Polling","Create useDocumentStatus hook. Poll job status every 5 seconds. Update UI on status change. Stop polling when complete/failed. Display error messages","frontend,ui",M,P1,Frontend,10,"#41,#45"
"Phase 5: Document Processing Pipeline","#47","Initialize Ingest Service","Setup Python project with uv. Create pyproject.toml. Install dependencies (PyMuPDF, python-docx, etc.). Create folder structure. Setup logging with loguru. Test imports","backend,ingest,setup",M,P0,Ingest,10,#1
"Phase 5: Document Processing Pipeline","#48","Setup Redis Queue Worker","Install redis and rq. Create worker.py entrypoint. Configure Redis connection. Queue listener setup. Job handler registration. Error handling","backend,ingest,queue",M,P0,Ingest,10,"#2,#47"
"Phase 5: Document Processing Pipeline","#49","PostgreSQL Connection (Ingest)","Install asyncpg. Create database connection utility. Query document by ID. Update document status. Connection pooling. Test queries","backend,ingest,database",S,P0,Ingest,4,"#2,#47"
"Phase 5: Document Processing Pipeline","#50","MinIO Client (Ingest)","Install boto3 or minio. Create MinIO client wrapper. Download file utility. Error handling. Test download from app-{id}/ path","backend,ingest,storage",S,P0,Ingest,4,"#2,#47"
"Phase 5: Document Processing Pipeline","#51","PDF Text Extraction","Install PyMuPDF (fitz). Extract text from PDF pages. Handle encrypted PDFs. Extract metadata (page count, etc.). Return structured text data. Unit tests","backend,ingest,document-processing",M,P0,Ingest,10,#47
"Phase 5: Document Processing Pipeline","#52","OCR for Scanned PDFs","Install pytesseract and pdf2image. Detect if PDF needs OCR (no extractable text). Convert PDF pages to images. Run Tesseract OCR. Combine with extracted text. Error handling","backend,ingest,document-processing,ocr",L,P1,Ingest,20,#51
"Phase 5: Document Processing Pipeline","#53","DOCX Text Extraction","Install python-docx. Extract paragraphs and text. Handle tables. Extract metadata. Return structured text. Unit tests","backend,ingest,document-processing",S,P0,Ingest,4,#47
"Phase 5: Document Processing Pipeline","#54","TXT/MD File Processing","Encoding detection with chardet. Read text files. Parse markdown (optional). Return structured text. Unit tests","backend,ingest,document-processing",S,P0,Ingest,3,#47
"Phase 5: Document Processing Pipeline","#55","Unified Document Parser","Factory pattern for file types. Route to appropriate parser. Consistent output format. Error handling for unsupported types. Logging","backend,ingest,architecture",M,P0,Ingest,10,"#51,#53,#54"
"Phase 5: Document Processing Pipeline","#56","Text Chunking Implementation","Install langchain-text-splitters. Configure RecursiveCharacterTextSplitter. Chunk size: 512 tokens. Overlap: 50 tokens. Preserve paragraph boundaries. Return chunks with metadata","backend,ingest,ai",M,P0,Ingest,10,#47
"Phase 5: Document Processing Pipeline","#57","Setup Embedding Model","Install sentence-transformers. Load all-MiniLM-L6-v2 model. GPU acceleration if available. Model caching. Test embedding generation","backend,ingest,ai",M,P0,Ingest,8,#47
"Phase 5: Document Processing Pipeline","#58","Generate Embeddings for Chunks","Batch process chunks. Generate 384-dim vectors. Include metadata (documentId, page, position). Error handling. Progress logging","backend,ingest,ai",M,P0,Ingest,10,"#56,#57"
"Phase 5: Document Processing Pipeline","#59","Qdrant Integration (Ingest)","Install qdrant-client. Connect to Qdrant. Create collection if not exists (app_{id}_docs). Configure vector params. Test connection","backend,ingest,vector-db",S,P0,Ingest,4,"#2,#47"
"Phase 5: Document Processing Pipeline","#60","Upsert Vectors to Qdrant","Batch upsert chunks to collection. Point ID generation strategy. Include payload (text, metadata). Per-application collection (multi-tenant!). Error handling. Confirm upload","backend,ingest,vector-db,multi-tenant",M,P0,Ingest,12,"#58,#59"
"Phase 5: Document Processing Pipeline","#61","Main Processing Job Handler","Fetch document from DB (with applicationId). Download file from MinIO. Parse document → Chunk → Embed. Upsert to Qdrant (correct collection!). Update Document status to INDEXED. Error handling → status FAILED. Log processing time","backend,ingest",L,P0,Ingest,20,"#48,#49,#50,#55,#60"
"Phase 5: Document Processing Pipeline","#62","Job Retry Logic","Exponential backoff. Max 3 retry attempts. Different handling for different errors. Update failure reasons in DB. Dead letter queue for manual review","backend,ingest,queue",M,P1,Ingest,10,"#48,#61"
"Phase 5: Document Processing Pipeline","#63","Processing Progress Updates","Update job progress (0-100%). Store current step (extracting, chunking, embedding). Update Document metadata. Log to database","backend,ingest",S,P1,Ingest,4,"#49,#61"
"Phase 6: RAG Query Engine","#64","Token Management API","POST /api/tokens (create for application). GET /api/tokens?applicationId={id}. DELETE /api/tokens/:id (revoke). Generate random token with nanoid. Hash with SHA-256 before storing. Show plaintext only once. Verify user has app access","frontend,api,auth,multi-tenant",M,P0,Frontend,12,"#13,#23"
"Phase 6: RAG Query Engine","#65","Token Management UI","Tokens list page per application. Create token button. Show token once modal (copy to clipboard). Revoke token confirmation. Last used timestamp. Mantine components","frontend,ui",M,P0,Frontend,10,"#8,#64"
"Phase 6: RAG Query Engine","#66","FastAPI Token Authentication","Extract Bearer token from header. Hash token with SHA-256. Query Token entity. Verify token exists and not expired. Get associated Application. Dependency injection for routes. Return 401 if invalid","backend,auth,multi-tenant",M,P0,Backend,12,"#13,#16"
"Phase 6: RAG Query Engine","#67","Query Request Model","Create Pydantic model for /query. Fields: query (text), top_k (int), temperature (float). Validation rules. Optional parameters. Response model","backend,api",S,P0,Backend,3,#16
"Phase 6: RAG Query Engine","#68","Query Embedding Generation","Reuse same embedding model as ingestion. Generate embedding for user query. Normalize vector. Error handling","backend,ai",S,P0,Backend,4,#19
"Phase 6: RAG Query Engine","#69","Vector Search in Qdrant","Search in app-specific collection (multi-tenant!). Use query embedding. Top-k retrieval (default k=5). Similarity score threshold. Return chunks with metadata. Handle empty results","backend,vector-db,multi-tenant",M,P0,Backend,10,"#18,#66,#68"
"Phase 6: RAG Query Engine","#70","Context Assembly for LLM","Format retrieved chunks into context. Inject application's system prompt. Build messages array for Ollama. Token counting. Truncate if exceeds context window. Log context size","backend,ai",M,P0,Backend,10,"#19,#66,#69"
"Phase 6: RAG Query Engine","#71","LLM Inference with Ollama","Call Ollama API with context. Model selection from Application config. Temperature and max_tokens configuration. Parse response. Error handling (timeout, model unavailable). Log inference time","backend,ai",M,P0,Backend,10,"#19,#70"
"Phase 6: RAG Query Engine","#72","POST /v1/query Endpoint","Validate token → get Application. Generate query embedding. Search app's Qdrant collection. Assemble context with system prompt. Call Ollama. Format response with sources. Return { answer, sources, metadata }. Update token last_used_at","backend,api,multi-tenant",L,P0,Backend,18,"#66,#67,#68,#69,#70,#71"
"Phase 6: RAG Query Engine","#73","Source Citations in Response","Include retrieved chunk text. Document references (filename, page). Relevance scores. Proper formatting. Return as part of response","backend,api",M,P0,Backend,8,#72
"Phase 6: RAG Query Engine","#74","Query Interface UI","Text input for question (Mantine Textarea). Submit button with loading state. Model selection dropdown. Temperature slider. Display response with formatting. Show thinking/loading animation","frontend,ui",L,P0,Frontend,16,"#8,#35,#72"
"Phase 6: RAG Query Engine","#75","Display Source Citations UI","Accordion for sources (Mantine). Show document name and page. Display chunk text. Relevance score badge. Link to document (if applicable)","frontend,ui",M,P0,Frontend,10,"#8,#73,#74"
"Phase 6: RAG Query Engine","#76","Query History","Store queries in database (optional). Display past queries. Re-run query button. Filter by application. Pagination","frontend,ui",M,P2,Frontend,12,"#8,#74"
"Phase 6: RAG Query Engine","#77","Health Check Endpoint","GET /v1/health. Check Ollama connectivity. Check Qdrant connectivity. Check Redis connectivity. Return status and versions","backend,api",S,P1,Backend,3,"#16,#18,#19"
"Phase 6: RAG Query Engine","#78","API Documentation","FastAPI auto-generates /docs. Add descriptions to endpoints. Add request/response examples. Document authentication. Document error codes","backend,docs",M,P1,Backend,8,#16
"Phase 7: Testing & Integration","#79","Multi-Tenancy Isolation Tests","Create 2 test applications. Upload same document to both. Verify separate Qdrant collections. Query both apps - no cross-contamination. Verify MinIO path isolation. Document test results","testing,multi-tenant,critical",L,P0,Testing,16,"#31,#40,#60,#72"
"Phase 7: Testing & Integration","#80","End-to-End Test - Document Flow","Create user and application. Upload PDF document. Wait for processing (INDEXED status). Verify in Qdrant collection. Query document content. Verify response accuracy. Automated test script","testing,e2e",L,P0,Testing,16,"#40,#61,#72"
"Phase 7: Testing & Integration","#81","Token Authentication Tests","Create token for app A. Try to use for app B (should fail). Revoked token test (should fail). Expired token test. Invalid token format test. Document security verification","testing,security,auth",M,P0,Testing,10,"#64,#66"
"Phase 7: Testing & Integration","#82","Error Handling Tests","Upload unsupported file type. Upload oversized file. Query with invalid token. Query non-existent application. Ollama unavailable scenario. Document all error paths","testing,error-handling",M,P1,Testing,10,"#40,#72"
"Phase 7: Testing & Integration","#83","Frontend Unit Tests","Test auth utilities. Test form validations. Test API client functions. Test utility functions. 70%+ coverage goal","testing,frontend",L,P1,Testing,16,Multiple
"Phase 7: Testing & Integration","#84","Backend Unit Tests","Test token hashing. Test embedding generation. Test chunking logic. Test Qdrant queries. 70%+ coverage goal","testing,backend",L,P1,Testing,16,Multiple
"Phase 7: Testing & Integration","#85","Load Testing - Document Upload","Simulate 10 concurrent uploads. Measure MinIO throughput. Monitor queue depth. Check for bottlenecks. Document results and limits","testing,performance",M,P2,Testing,12,"#40,#45"
"Phase 7: Testing & Integration","#86","Load Testing - RAG Queries","Simulate 50 concurrent queries. Measure response times (p50, p95, p99). Test Ollama under load. Monitor Qdrant performance. Document performance characteristics","testing,performance",M,P2,Testing,12,#72
"Phase 7: Testing & Integration","#87","Database Query Optimization","Analyze slow queries. Add missing indexes. Optimize TypeORM relations loading. Test with larger dataset (1000+ documents). Document optimizations","backend,database,performance",M,P1,Database,12,Multiple
"Phase 7: Testing & Integration","#88","Error Logging & Monitoring Setup","Structured JSON logging. Log levels (debug, info, warn, error). Correlation IDs across services. Error aggregation (Sentry optional). Log rotation","devops,monitoring",M,P1,DevOps,10,Multiple
"Phase 8: Deployment & Production","#89","Production Dockerfiles","Multi-stage build for Next.js. Optimize image size. Security scanning. Non-root user. Health checks. Document build process","devops,docker",M,P0,DevOps,12,#2
"Phase 8: Deployment & Production","#90","Production Docker Compose","Separate production config. Environment variable management. Volume persistence strategy. Network security. Resource limits. Backup configuration","devops,docker",M,P0,DevOps,12,#2
"Phase 8: Deployment & Production","#91","Environment Variables Setup","Create .env.production.example. Document all required vars. Secrets management strategy. Validation on startup. Security review","devops,config,security",S,P0,DevOps,4,None
"Phase 8: Deployment & Production","#92","Database Migration Strategy","Production migration workflow. Backup before migrate. Rollback plan. Zero-downtime migration guide. Test on staging","devops,database",M,P0,DevOps,10,#4
"Phase 8: Deployment & Production","#93","Choose Deployment Platform","Evaluate options (Railway, DigitalOcean, Render). Cost analysis. Performance comparison. Make decision and document. Setup account","devops,planning",S,P0,DevOps,5,None
"Phase 8: Deployment & Production","#94","Deploy to Production","Setup managed PostgreSQL. Setup managed Redis. Deploy containers. Configure domains. SSL/TLS setup. Test deployment","devops,deployment",L,P0,DevOps,20,"#89,#90,#93"
